{
  "$schema": "http://json-schema.org/draft-07/schema#",
  "$id": "https://github.com/ChalBAS/ai-operating-system/.ai/project-state.schema.json",
  "title": "AI OS Project State",
  "description": "Canonical machine-readable project-state snapshot. Current-state index, NOT a replacement for roadmap/architecture/decision documents — those are referenced via pointers.",
  "type": "object",
  "required": ["schema_version", "project", "state", "last_updated", "pointers"],
  "additionalProperties": false,
  "properties": {
    "schema_version": { "type": "string", "const": "1.0" },
    "project": {
      "type": "object",
      "required": ["id", "name"],
      "additionalProperties": false,
      "properties": {
        "id": { "type": "string", "minLength": 1, "pattern": "^[a-z0-9][a-z0-9-]*$" },
        "name": { "type": "string", "minLength": 1 },
        "repository": { "type": "string" },
        "objective": { "type": "string" }
      }
    },
    "state": {
      "type": "object",
      "required": ["status"],
      "additionalProperties": false,
      "properties": {
        "status": { "type": "string", "enum": ["planned", "active", "blocked", "paused", "completed", "archived"] },
        "phase": { "type": "string" },
        "current_focus": { "type": "string" }
      }
    },
    "last_updated": {
      "type": "object",
      "required": ["timestamp", "agent"],
      "additionalProperties": false,
      "properties": {
        "timestamp": { "type": "string", "pattern": "^\\d{4}-\\d{2}-\\d{2}T\\d{2}:\\d{2}:\\d{2}Z$" },
        "agent": { "type": "string", "minLength": 1 }
      }
    },
    "last_completed": {
      "type": "array",
      "items": {
        "type": "object",
        "required": ["id", "summary", "date"],
        "additionalProperties": false,
        "properties": {
          "id": { "type": "string", "minLength": 1 },
          "summary": { "type": "string", "minLength": 1 },
          "date": { "type": "string", "pattern": "^\\d{4}-\\d{2}-\\d{2}$" },
          "commit": { "type": "string" }
        }
      }
    },
    "next_actions": {
      "type": "array",
      "items": {
        "type": "object",
        "required": ["id", "summary"],
        "additionalProperties": false,
        "properties": {
          "id": { "type": "string", "minLength": 1 },
          "summary": { "type": "string", "minLength": 1 }
        }
      }
    },
    "blockers": {
      "type": "array",
      "items": {
        "type": "object",
        "required": ["id", "summary"],
        "additionalProperties": false,
        "properties": {
          "id": { "type": "string", "minLength": 1 },
          "summary": { "type": "string", "minLength": 1 },
          "date": { "type": "string", "pattern": "^\\d{4}-\\d{2}-\\d{2}$" }
        }
      }
    },
    "parked": {
      "type": "array",
      "items": {
        "type": "object",
        "required": ["id", "summary", "reason"],
        "additionalProperties": false,
        "properties": {
          "id": { "type": "string", "minLength": 1 },
          "summary": { "type": "string", "minLength": 1 },
          "reason": { "type": "string", "minLength": 1 },
          "revisit": { "type": "string" }
        }
      }
    },
    "decisions": {
      "type": "array",
      "items": {
        "type": "object",
        "required": ["id", "summary"],
        "additionalProperties": false,
        "properties": {
          "id": { "type": "string", "minLength": 1 },
          "summary": { "type": "string", "minLength": 1 },
          "source": { "type": "string" }
        }
      }
    },
    "health": {
      "type": "object",
      "additionalProperties": false,
      "properties": {
        "tests": { "type": "string", "enum": ["passing", "failing", "unknown", "not-run"] },
        "deployment": { "type": "string", "enum": ["verified", "unverified", "failing", "unknown"] },
        "known_critical_issue": { "type": "boolean" }
      }
    },
    "pointers": {
      "type": "object",
      "required": ["status"],
      "additionalProperties": false,
      "properties": {
        "roadmap": { "type": "string" },
        "architecture": { "type": "string" },
        "status": { "type": "string" },
        "decisions": { "type": "string" },
        "parked_register": { "type": "string" }
      }
    }
  }
}
